EN_WORD,WORD,DEFINITION
acaulous,То,"так же, как и Acaulescent."
accadian,Аккадиан,"относится к расе, которая якобы жила в Вавилоне до ассирийского завоевания."
acceded,Присоединяются,от Access
acceding,присоединение,от Доступа
accede,Присоединяйся,к приближению; к продвижению; — против отступления.
accede,Присоединиться,для вступления в должность или достоинство; для достижения.
accede,"Присоединяйся,","стать стороной, ассоциируя себя с другими; дать свое присоединение; поэтому, согласиться или присоединиться к предложению или мнению; как, он присоединился к моему запросу."
accedence,Присоединяйся,акт доступа.
acceder,Присоединяющийся.,"человек, который получает доступ."
accelerando,accelérando,постепенно ускоряйте движение.
accelerated,Ускорение,ускоренного
accelerating,Ускорение,ускорения
accelerate,-,"для того, чтобы заставить двигаться быстрее; для того, чтобы ускорить движение; для того, чтобы добавить к скорости; — в отличие от задержки."
accelerate,-,"для ускорения естественного или обычного прогрессирования или процесса; как, для ускорения роста растения, увеличения богатства и т.д."
accelerate,Ускорить,"чтобы ускорить, как возникновение события; как, чтобы ускорить наше отправление."
acceleration,-,"акт ускорения, или состояние ускорения; увеличение движения или действия; как, падающее тело движется к земле с ускорением скорости; — в отличие от задержки."
accelerative,акклеративность,относятся к ускорению; добавляют к скорости; ускоряют.
accelerator,акселератор,"кто, или кто, ускоряет."
acceleratory,Ускоряющая,ускоряющего.
accelerograph,accelerograph,аппарат для изучения сжигания пыли в пистолетах и т.д.
accelerometer,accelerometer,"Прибор для измерения скорости, выделенной пистолетом."
accend,"Подожгить,",для установки на огонь; для зажигания.
accendibility,способность,способность быть поджелудочной или воспаленной; воспаленность.
accendible,-,способность быть воспаленным или зажизненным; топливный; воспаленный.
accension,-,акт кидания или состояние кидания; огонь.
accensor,(cccensor,"один из чиновников, который освещает и окрашивает таперы."
accent,Высочайшая,"Высшая сила голоса или артикулятивного усилия на какой-то конкретную силу слова или фразы, отличая ее от других."
accent,-,"знак или характер, используемый в письменном виде и служащий для регулирования произношения; esp.: (a) знак, указывающий характер и место выраженного акцента; (b) знак, указывающий качество звука знака кишечника; как, французские акценты."
accent,Оговорку,"Модуляция голоса в говорении; способ речи или произнесения; характерная или характерная модификация голоса; тонус; как, иностранный акцент; французский или немецкий акцент."
accent,Ударный,слово; значительный тонус
accent,Выражения,выражения в целом; речь.
accent,Угол,стресс накладывается на определенные сланки стиха.
accent,Угол,"регулярное повторяющееся давление на тонус, чтобы указать начало, и, более слабо, третью часть измерения."
accent,Особое,"особый акцент тона, даже в более слабой части измерения."
accent,-,"ритмический акцент, который обозначает фразы и секции периода."
accent,Упор,выразительный акцент и тень прохождения.
accent,Надпись,"знак, помещенный в правой руке письма, и чуть выше него, чтобы отличить величины аналогичного рода, выраженные тем же письмом, но различающиеся в значении, как y, y»."
accent,-,"знак в правой руке числа, указывающий минуты степени, секунды и т. д.; как, 12'27'', и т. д., двенадцать минут двадцать семь секунд."
accent,"Огонь,","Марка, используемая для обозначения ног и дюймов; как, 6' 10'' составляет шесть футов десять дюймов."
accented,Упорный,акцент
accenting,при,акцента
accent,-,для выражения акцента (или голосом или знаком); для выражения или для маркировки акцентом.
accent,Угол:,для маркировки эмпатически; для подчеркивания.
accentless,Без,без акцента.
accentor,▪,кто пеет ведущую часть; директор или лидер.
accentor,Род,"жанр европейских птиц (так называемый из их сладких нотеров), в том числе хейдж-верблер."
accentuable,Усилимый,способность быть акцентированным.
accentual,Углубленный,от или относятся к акценту; характеризуется или формируется акцентом.
accentuality,Увеличенность,качество акцентальности.
accentually,"Углубленно,",акцентно; в соответствии с акцентом.
accentuated,Уделение,от Accentuate
accentuating,Уделение,от Accentuate
accentuate,Уделение,для произнесения акцентом или акцентом.
accentuate,Уделение,выделить особым образом; сделать провозглашенным; подчеркнуть.
accentuate,Увеличь,Маркировать с письменным акцентом.
accentuation,Усиление,акт акцентации; приложения акцента.
accentuation,Углубление,место или модуляцию голоса в рецензирующих частях литургии.
accepted,Принято,от Принятое
accepting,Принимается,от Принимать
accept,Принимать,"принимать с согласительным умом (что-то предлагается); как, принять дар; — часто следуя."
accept,"Примите,",принимать с благой; одобрять.
accept,Принимаю,"принять или признать и согласиться; признать; как, я принимаю ваше предложение, изменение, или извинение."
accept,Принимать,"принять ум; понять; как, как эти слова должны быть приняты?"
accept,Признать,"принимать как обязательный и обещать платить; как, принять счёт обмена."
accept,"Признать,","в умышленном органе, чтобы получить в исполнении наложенного обязанности; как, чтобы принять доклад комитета. [Это делает его имуществом органа, а затем вопрос о его принятии.]"
accept,Принимается.,Принято.
acceptability,Приемлемость:,качество быть приемлемым; приемлемость.
acceptable,"Приемлемая,","способный, достойный, или уверенный в том, что он принимается или принимается с удовольствием; удовлетворяющий получателю; удовлетворяющий; приемлемый; приветствующий; как, приемлемый подарок, приемлемый для нас."
acceptableness,-,"качество быть приемлемым, или подходит для благоприятного приема; приемлемость."
acceptably,Приемлемым,в приемлемом виде; в способе удовлетворения или удовлетворения.
acceptance,-,"акт принятия; получание того, что предлагается, с одобрением, удовлетворением, или приобретением; эпп, благоприятный прием; утверждение; как, принятие дара, служебного, доктринного и т.д."
acceptance,-,состояние принятия; приемлемость.
acceptance,-,"ассистент и обязательство лица, на которого выписывается обменный счёт, оплатить его, когда он должен в соответствии с условиями принятия."
acceptance,::,"сам законопроект, когда он принят."
acceptance,Согласие,"согласие на условия или предложения, по которым заключается договор, и стороны обязаны; прием или принятие купленного предмета в качестве того, для чего он был куплен, или в качестве того, что согласилось быть доставлено, или принятие собственности в качестве владельца."
acceptance,Согласие,"согласие на действие другого, каким-то актом, который связывает человека к закону."
acceptance,-,Значение; Принятие.
acceptancy,Принятие.,Принятие.
acceptant,Приемлемый,Прием; Прием.
acceptant,Приемлемый,Приемник.
acceptation,-,Принятие; Принятие; Благоприятный прием или отношение; Состояние принятия.
acceptation,"Значение,","значение, в котором слово или выражение понимается, или в целом получается; как, термин используется в соответствии с его обычным принятием."
acceptedly,Приемлемым,в принятом виде; приемлемо.
accepter,"Лицо,","человек, который принимает; тактер."
accepter,"Уважаемый,",уважитель; зритель с частичностью.
accepter,Приемщик,Приемник.
acceptilation,Освобождение,Бесплатный отказ; освобождение от долга или обязательства без уплаты; бесплатный отказ.
acception,Приемлемость:,Прием; Полученное значение.
acceptive,Приемлемый,Подходит для принятия.
acceptive,Готов,готов к принятию.
acceptor,Принимающий,кто принимает
acceptor,Приемщик,"тот, кто принимает заказ или обменный счет; драйвер после его принятия."
access,Приближение,"приближающийся или близкий подход; прием; прием; доступность; как, чтобы получить доступ к принцу."
access,::,"средства, место или способ, с помощью которого вещь может быть приближена; путь прохода; как, доступ происходит через шею земли."
access,Прием,Прием к половому контакту.
access,-,"увеличение чем-то добавленным; добавление; как, доступ к территории. [В этом смысле присоединение более широко используется.]"
access,-,"возникновение, нападение или приспособление болезни."
access,-,"Параксизм; приспособление страсти; взрыв; как, доступ гнева."
accessarily,В,в виде дополнительного.
accessariness,imployarism,состояние быть доступным.
accessary,"Сопровождение,","сопровождающий, как подчиненный; дополнительный; аксессуар; esp., объединяющий или способствующий преступлению, но не как главный актёр."
accessaries,-,от Дополнителей
accessary,"Тот,","человек, который, не присутствуя, в качестве помощника или стимулятора способствует совершению преступления."
accessibility,-,Качество доступности или принятия подхода; приемлемость.
accessible,-,"легкодоступный или доступный; доступный; как, доступный город или гору, доступный человек."
accessible,-,открытый к влиянию; — с.
accessible,-,Доступно; быть получено.
accessibly,В,в доступном виде.
accession,Присоединение,"присоединение к; акт присоединения и присоединения к; как, присоединение короля к конфедерации."
accession,"Присоединяясь,","увеличение чем-то добавленным; то, что добавляется; увеличение из-за отсутствия; как, присоединение богатства или территории."
accession,Присоединение:,"способ приобретения имущества, по которому владелец телесной субстанции, получающей добавление путем роста или труда, имеет право на добавленную часть или вещь, или на улучшение (при условии, что вещь не изменяется в другой вид)."
accession,::,"акт, посредством которого одна сила становится стороной обязательств, уже существующих между другими силами."
accession,Присоединение,"акт прихода или достижения престола, должности или достоинства; как, присоединение к дому Стюарта; — применялся особенно к эпохе новой династии."
accession,"Вторжение,","вторжение, подход или начало болезни; присоединение или параксизм."
accessional,Присоединение:,относится к присоединению; дополнительный.
accessive,Дополнительно.,Дополнительный.
accessorial,аксессуары,"От или относятся к аксессуару; как, аксессуары агентства, аксессуары вины."
accessorily,i),в виде аксессуара; вспомогательного.
accessoriness,Сопутствующее,состояние принадлежности или подчиненности.
accessory,Соучастие,"сопровождающийся как подчиненный; помогающий вторичным способом; дополнительный; связанный как инцидент или подчиненный к главному; содействующий или содействующий; рассказывающий о людях и вещах, и, когда о людях, обычно в плохом смысле; как, он был аксессуаром к бунту; аксессуарные звуки в музыке."
accessories,Принадлежности,от Аксессуары
accessory,Сопутствующее,"то, что принадлежит чему-то другому, считается главным; что-то дополнительное и подчиненное."
accessory,То,"Точно так же, как и Дополнительное, n."
accessory,аксессуары,"все, что входит в произведение искусства, не являясь неизбежно необходимым, как просто декоративные части."
acciaccatura,acciaccatura,"кратковременная нота благодати, один семитон ниже ноты, к которой она предусмотрена; - используется особенно в органовой музыке."
accidence,Несчастные,"несчастные случаи, переломы слов; основы грамматики."
accidence,-,основы любого предмета.
accident,-,"буквально, поражение; событие, происходящее без предсказания или ожидания; непредсказуемое, внезапное и неожиданное событие; случайность; непрерывность; часто непредсказуемое и непредсказуемое возникновение неприятного или несчастного характера; несчастный случай; несчастный случай; несчастный случай; смерть от несчастного случая."
accident,Несчастный,"имущество, привязанное к слову, но не существенное к нему, как к роду, номер, случай."
accident,Остановка,"точка или знак, который может быть задержан или пропущен в палубе оружия."
accident,b),"свойство или качество вещи, которая для нее не необходима, как белость на бумаге; атрибут."
accident,-,"Качество или атрибут в отличие от вещества, как сладость, мягкость."
accident,-,"любое случайное имущество, факт или отношение; случайное или несущественное; как, красота является несчастным случаем."
accident,Необычный,необычный внешний вид или эффект.
accidental,Случайное,"происходящее случайно или неожиданно; происходящее не в соответствии с обычным ходом вещей; случайное; случайное; как, случайное посещение."
accidental,"Незначительное,","Несущественный; не обязательно принадлежащий; случайный; как, являются случайными для игры."
accidental,Несчастный,неотъемлемое имущество; неотъемлемое имущество; все происходящее случайно.
accidental,Случайное,"эти фактуальные эффекты, вызванные светлыми лучами, падающими на определенные объекты, так что некоторые части выглядят в аномальной яркости, а другие части выкидываются в глубокую тень."
accidental,-,"острый, плоский или естественный, возникающий не в начале песни как подписи, а перед конкретной записью."
accidentalism,Случайный,несчастный характер или эффект.
accidentality,-,качество быть случайным; случайность.
accidentally,"Случайно,",Случайно; неожиданно; Случайно; Ненамеренно; Случайно; Случайно; Несущественно.
accidentalness,-,качество быть случайным; случайность.
accidie,-,Sloth; torpor.
accipenser,accypeenser,Смотреть «приемник».
accipient,Приемник.,получатель.
accipiters,акципитеры,от Аципитера
accipitres,аккумуляторы,от Аципитера
accipiter,accipiter,жанр раптовых птиц; один из Accipitres или Raptores.
accipiter,accipiter,"связь наносится над носом, похожая на ковчег."
accipitral,accipittral,"относящийся к, или к характеру, фалькон или хавк; хавк."
accipitres,"Приказ,","порядок, который включает рапатовые птицы. Они имеют острые, сильно закрученные талоны. Есть три семьи, представленные волтами, фальконами или говядинами, и овцами."
accipitrine,accipitrine,как или принадлежащий к Аципитре; рапториальный; хавклик.
accismus,accismus,пораженный отказ; коинс.
accite,Противостояние:,для цитирования; для обобщения.
acclaim,Приветствую,Аплодисментировать.
acclaim,возражаю:,декларировать признаниями.
acclaim,"Признайся,","чтобы кричать; как, чтобы признать мою радость."
acclaim,"Признай,",чтобы кричать приветствие.
acclaim,"Признай,",Признание.
acclaimer,Возражаю:,"тот, кто приглашается."
acclamation,Крик,"крик одобрения, прощения или абсента; жестокое выражение одобрения; громкое приветствие."
acclamation,Разъяснение:,"представление, в скульптуре или на медалях, людей, выражающих радость."
acclamatory,Поощряющее,"относится к, или выражает одобрение, аккламацией."
acclimatable,акклиматизируемая,способность быть акклиматизированным.
acclimatation,-,акклиматизация.
acclimated,акклиматизированная,от Аклиматизированного
acclimating,акклемация,от «аклиматизации»
acclimate,aclimate,привыкнуть к нерожденному климату; акклиматизировать.
acclimatement,aclimatement,акклиматизация.
acclimation,процесс,"процесс становления, или состояние бытия, акклиматизированного, или привыкшего к новому климату; акклиматизация."
acclimatizable,акклиматизируемая,способность быть акклиматизированным.
acclimatization,Акт,"акт акклиматизации; процесс инвентаризации в новый климат, или состояние такового инвентаризации."
acclimatized,акклиматизированная,от «аклиматизированного»
acclimatizing,акклиматизация,акклиматизации
