EN_WORD,WORD,DEFINITION
active,Активные,"иметь силу или качество действия; вызывать изменения; общение действия или движения; действовать; — в отличие от пассивного, получающего; как, определенные активные принципы; силы ума."
active,Активное,"быстрый в физическом движении; агильного и жизнерадостного тела; нимбл; как, активный ребенок или животное."
active,Активные,"в действии; фактически прогрессируя; работая; в силе; против тихого, спящего или исчезающего; как, активные законы; активные враждебности; активный вулкан."
active,"Активные,","принимая во внимание действие; постоянно вовлечен в действие; энергетический; тщательный; занятый; — в отличие от глупых, слегких, безжалостных или инертивных; как, активный бизнесмен; активный ум; активный зель."
active,-,"требование или предполагающее действие или упражнение; - против седентарного или спокойного; как, активное занятие или обслуживание; активные сцены."
active,::,"учитывая действие, а не воображение; практический; оперативный; - противоположный спекулятивному или теоретическому; как, активный, а не спекулятивный государственник."
active,"Активный,","бриск; живой; как, активный спрос на кукурузу."
active,-,"имплементировать или производить быстрое действие; как, активное заболевание; активное средство."
active,Активный,Применяется к форме верба; — в отличие от пассивного.
active,Применяется,"Применяется к вербам, которые утверждают, что субъект действует или влияет на что-то другое; переходный."
active,Применяется,"Применяется ко всем вербам, которые выражают действие как отдельное от простого существования или состояния."
actively,"Активно,","в активном виде; нимбли; бриллиантно; энергично; также, собственным действием; добровольно, а не пассивно."
actively,Активно,"в активном значении; как, слово используется активно."
activeness,-,качество быть активным; нименность; скорость движения; активность.
activities,Виды,деятельности
activity,::,"состояние или качество активности; нименность; гибкость; сильное действие или действие; энергия; активная сила; как, растущее разнообразие человеческой деятельности."
actless,Без,без действия или духа.
acton,acton,"застрявшаяся куртка, ношенная под почтой, или (позднее) куртка, покрытая почтой."
actor,-,"человек, который выступает или принимает участие в любом деле; актёр."
actor,Актёр,театральный исполнитель; сценарист.
actor,Актёр,адвоката или прокурора в гражданских судах или делах.
actor,"Лицо,","человек, который устанавливает иск; жалоба или жалоба."
actress,актриса,Женская актриса или актриса.
actress,::,"Женский сценарист; Женщина, которая выступает в роли."
actual,Фактическое,участвующую или составляющую действие; активную.
actual,factal,"существование в действии или реальности; действительное или действительное; действительное; - противоположное потенциальному, возможному, виртуальному, спекулятивному, предсказуемому, теоретическому или номиналному; как, фактическая стоимость товара; фактический случай, обсуждаемый."
actual,Фактические,в действии в настоящее время; теперь выходя; настоящий; как реальное положение страны.
actual,Фактически,"что-то фактически получается; реальное, как отличается от предполагаемого, получается."
actualist,"Тот,","тот, кто занимается или рассматривает фактически существующие факты и условия, а не фантазии или теории; - против идеалиста."
actualities,Фактическая,актуальность
actuality,Фактическое,"состояние реального; реальность; как, реальность Божией природы."
actualization,Фактическое,сделать реальным или действительно существующим.
actualize,"Фактифицируйте,",сделать реальным; реализовать в действии.
actually,"Вообще-то,",Активно.
actually,На,в действии или на самом деле; на самом деле; на самом деле; положительно.
actualness,Фактическая,качество быть реальным; актуальность.
actuarial,Актуарий,"от или относящегося к актуариям; как, актуарийная стоимость годовой стоимости."
actuaries,Актуарии,от Actuary
actuary,Секретарь,"Регистратор или слуга; — используется изначально в судах гражданской юрисдикции, но в Европе используется для слуги или регистратора в целом."
actuary,-,"компьютерный чиновник страховой компании; профессия которого заключается в расчете для страховых компаний рисков и премий за жизнь, огонь и другие страховые услуги."
actuated,Приведение,от Actuate
actuating,Приведение,от Актуализации
actuate,Приведение,"вводить в действие или движение; двигаться или стимулировать к действию; активно влиять; двигаться так, как делают мотивы; — чаще используется людьми."
actuate,Приведение,выполнять в практике; выполнять.
actuate,Приведение,ввести в действие; действовать.
actuation,Приведение,введение в действие; движение.
actuator,"Тот,","человек, который действует или вступает в действие."
actuose,Актуально,очень активный.
actuosity,Актуативная,изобильная деятельность.
acture,Мотор.,действие.
acturience,-,тенденция или импульс к действию.
acuate,аккумулировать,для острых; для острых; для острых.
acuate,аккумулируемый,оскорбитель; оскорбитель.
acuation,Заточение.,акт очертания.
acuition,Искусство,акт окрашивания.
acuity,-,"резкость или резкость, как игла, грыжа и т. д."
aculeate,"акулетируйся,","имея камень; покрытый прыжками; острый, как прыжка."
aculeate,акулетируйте,"имея прыщи, или острые точки; насыщенные прыщими."
aculeate,-,тяжелый или острый; инцизивный.
aculeated,У,имея острый пункт; вооруженный прикосами; блестящий; аккулированный.
aculeiform,Акулеиформа,как грязь.
aculeolate,акулеолатный,имея небольшие прыжки или острые точки.
aculeous,акулетируйся.,Акулетное.
aculei,aculei,от «акулей»
aculeus,акулеус,"грыжи растут на плече, как и в некоторых картофелях и розах."
aculeus,Ужасно.,Стан.
acumen,Быстрое,Скорость восприятия или различия; проникновение ума; способность к приятной дискриминации.
acuminate,-,"прикосновение к точке; указание; как, накопление листьев, зубов и т.д."
acuminate,аккумулировать,чтобы сделать острый или острый.
acuminate,Заканчивайте,"чтобы закончиться в, или прийти к, резкой точке."
acumination,-,оскорбление; прекращение в острой точке; тапинг-точка.
acuminose,аккумулируемый,"Окончание в плоском, узком конце."
acuminous,-,характеризуется акуменом; желающим.
acupressure,-,"способ удержания кровотечения, вызванного ранами или хирургическими операциями, проходя под разделенным сосудом иглу, концы которой остаются внешне подвергнуты поверхности кожи."
acupuncturation,acupuncuration,Смотреть Акупунктуру.
acupuncture,-,нажимание иглой; нажимание иглой.
acupuncture,-,введение игл в живые ткани для лечебных целей.
acupuncture,иглоукалывание,для лечения с акупунктурой.
acustumaunce,Посмотрите,Смотреть «Акустумаунце».
acutangular,Острый.,острый угол.
acute,Острый,"острый в конце; заканчивается в острой точке; указано; - противоположно блунту или обтузу; как, острый угол; острый лист."
acute,"Острый,","имея приятное понимание; воспринимая или используя минутные различия; проникая; умный; раздраженный; - против глупых или глупых; как, острый наблюдатель; острые замечания или размышления."
acute,-,"иметь приятную или быструю чувствительность; чувствительную к незначительным впечатлениям; активно действовать на ощущениях; острый; острый; интенсивный; как, человек острых глаз, слыха или ощущений; острый боль или удовольствие."
acute,"Острый,","высокий, или шрилл, по отношению к какому-то другому звуку; — в отличие от гробного или низкого; как, острый тонус или акцент."
acute,Острый,"столкнулся с симптомами определенной степени тяжести, и быстро пришел к кризису; — в отличие от хронического; как, острой болезни."
acute,"Острый,","для того, чтобы дать острый звук; как, он острит свою растущую инфляцию слишком много."
acute-angled,Острый,"имея острые углы; как, острый уголный треугольник, треугольник с каждым углом меньше, чем правом углом."
acutely,"острое,",в острой форме; резко; резко; с приятной дискриминацией.
acuteness,Острость,"качество острой или обозначенной; резкость; как, резкость угла."
acuteness,Острость.,"способность приятного различия или восприятия; акументность; суть; резкость; чувствительность; - применимый к сенсам, или пониманию. посредством остроты ощущений мы воспринимаем мелкие предметы или легкие впечатления: посредством остроты интеллекта мы различаем приятные отличия."
acuteness,Острость,громкость; высокий слой; — говорится о звуках.
acuteness,Острый,"Насилие болезни, которое быстро приводит к кризису."
acutifoliate,acutifoliate,имея острые листья.
acutilobate,акутилобат,"имея острые лобы, как и некоторые листья."
ad-,"Ad-о-о-о-о-о,","как префикс ad- принимает формы ac-, af-, ag-, al-, an-, ap-, ar-, as-, at-, ассимилируя d с первой буквой слова, к которой ad- является префиксированным. оно остается неизменным до волей, и до d, h, j, m, v. Примеры: aducce, adhere, adjacent, admit, advent, accord, affect, aggregate, allude, annex, appear, etc. Оно становится ac- до qu,"
adact,-,для принуждения; для вождения.
adactyl,Адактил,Alt. of Adactylous
adactylous,без,без пальцев или без пальцев.
adactylous,без,без клещей на ногах (от крестовых животных).
adage,Старая,"старый стих, который получил кредит по длительному использованию; пророчество."
adagial,Привлекательно,относится к азиазу; произношение.
adagio,"Медленно,","медленно; медленно, расслабительно и милосердно.Когда повторяется, адагио, адагио, это направляет движение очень медленно."
adagio,Adagio,"кусочек музыки в час адагио; медленное движение; как, адагио Хейдна."
adam,(Ж),"имя, которое в Библии дано первому человеку, предшественнику человеческой расы."
adam,(Ж),«Оригинальный грех;» человеческая слабость.
adamant,"Камень,","Камень, представленный некоторыми, чтобы быть непроницаемой жесткостью; название, дано алмазу и другим веществам крайней жесткости; но в современной минералогии он не имеет технического значения."
adamant,Непреклонный,Lodestone; магнит.
adamantean,Абсолютно,от adamant; жесткий как adamant.
adamantine,-,"сделанный из адаманта, или имеющий качества адаманта; неспособный быть разбитым, растворенным или проникнут; как, адамантинные связывания или цепи."
adamantine,как,как диамант в жесткости или ластере.
adambulacral,Адамбулакрил,"рядом с амбулакрай; как, адумбакральные оксицы рабочего."
adamic,Adamic,Alt. of Adamical
adamical,"Адамически,","либо относится к Адаму, либо напоминает его."
adamite,"Ах,",потомство Адама; человеческое существо.
adamite,Одна,"один из секта визионеров, который, проповедуя имитировать состояние Адама, отказался от использования одежды в своих собраниях."
adam's apple,Яблочное,Смотреть под Адамом.
adance,Танцуем.,танцы.
adangle,Адапель,«дангла».
adansonia,Род,"жанр больших деревьев, связанных с Бомбаксом. Есть два вида, А. цифтата, баобаб или обезьянное хлеб Африки и Индии, и А. Грегори, суровое гордо или крема-от-татарное дерево Австралии. Оба имеют трон умеренной высоты, но огромного диаметра, и широкораспространенную голову. Плоды облонны и наполняются приятным кислотным пульпом."
adapt,Адаптация:,приспособленный; приспособленный.
adapted,Скорректированная,от Adapt
adapting,Адаптация,от Adapt
adapt,адаптировать,"для того, чтобы сделать подходящим; для того, чтобы подходить или подходить; для того, чтобы приспособиться; для того, чтобы изменить, чтобы подходить для нового использования; — иногда последует для или для."
adaptability,Приспособляемость,Alt. of Adaptableness
adaptableness,Приспособляемость:,Качество адаптируемости; приспособимость.
adaptable,Приспособляемость,способность быть адаптированным.
adaptation,-,акт или процесс адаптации или приспособления; или состояние адаптации или приспособления; фитнес.
adaptation,Результат,результат адаптации; адаптированная форма.
adaptative,Адаптивное,адаптивный.
adaptedness,-,состояние или качество адаптации; приспособление; специальная фитнес.
adapter,адаптационное,"человек, который адаптируется."
adapter,адаптационную,соединительная труба; усыновщик.
adaption,Адаптация:,адаптация.
adaptive,Адаптивная,"подходит, дается или склоняется к адаптации; характеризуется адаптацией; способен адаптировать."
adaptiveness,-,качество адаптивности; способность адаптироваться.
adaptly,адаптируемый,в соответствующем виде.
adaptness,адаптивность,адаптивность.
adaptorial,Адаптивная.,адаптивный.
adar,Двенадцатый,Двенадцатый месяц еврейского церковного года и шестой месяц гражданского.
adarce,Адарс,"соленая конкреция на глине и траве в маршиных почвах в Галатии. она мягкая и порочная, и ранее использовалась для очистки кожи от трещин и татер, а также в лепрозии."
adatis,Адатис,Красивая памучная одежда Индии.
adaunt,Приветствую,для даунта; для подавления; для смягчения.
adaw,"Одежда,",подводить; подводить.
adaw,"Проснуться,",пробудить; пробудить.
adays,Днем,"по дню, или каждый день; в дневное время."
ad captandum,Ad,"фраза, используемая адекватно иногда заслуженными попытками захватить или выиграть популярную пользу."
added,добавлено,от Добавить
adding,добавление,Add
add,*,давать путем увеличения собственности (для любого); давать (на).
add,Добавить:,"объединить или объединить, как одно вещь к другому, или как несколько частей, таким образом, чтобы увеличить число, увеличить количество, увеличить величину, или таким образом, чтобы сформировать в один агрегат."
add,Добавить,"Добавить, как заявление; сказать далее."
add,Добавьте,"для того, чтобы добавить; для того, чтобы увеличить; для того, чтобы увеличить; как, это добавляет к нашему тревогу."
add,Добавьте,"для выполнения аритметической работы добавления; как, он быстро добавляет."
addable,Свободный,Додается.
addax,Один,"один из крупнейших африканских антелопов (Хиппотрагус, / Орикс, носомакулат)."
addeem,Добавить,давать; давать.
addenda,добавления,от Addendum
addendum,Добавление,"вещь, которая должна быть добавлена; дополнение или дополнение."
adder,Кто,"человек, который, или тот, который добавляет; esp., машина для добавления цифр."
adder,Змея.,Змея.
adder,Небольшая,Маленькая венозная змея рода Випера. Общий европейский аддер — випера (/пелий) берус.
adder,В,"в Америке термин обычно применяется к нескольким безобидным змеям, таким как молочный аддер, пуфинг аддер и т.д."
adder,То,"Точно так же, как и Sea Adder."
adder fly/,::,Dragon fly.
adder's-tongue,Род,"жанр грызунов (Ophioglossum), семена которых вырабатываются на спике, напоминающей язык змеи."
adder's-tongue,"""Желтый",Желтый виолетовый зуб.
adderwort,adverwort,Общий бисторт или снайпер (Polygonum bistorta).
addibility,-,количество быть добавленным; способность добавлять.
addible,-,способность быть добавленным.
addice,См.,Смотреть Adze.
addict,Зависит,Зависимый; посвященный.
addicted,Зависимость,от «зависимого»
addicting,Зависимость,от «зависимости»
addict,Применить,применять привычно; посвящать; привыкать; — с тем.
addict,"Приспособиться,",адаптироваться; подходить; подходить.
addictedness,Зависимость:,Качество или состояние зависимости; привязанность.
addiction,-,состояние зависимости; отверстие; наклонение.
addison's disease,Болезнь,"болезненное состояние, вызывающее особый коричневый деколор кожи, и думал, в одно время, быть вызвано болезнью надпочечных капсул (две плоские трояндные тела, покрывающие верхнюю часть почек), но теперь известно, что не зависят от этих причин исключительно."
additament,"Добавление,",Добавка или добавленная вещь.
