EN_WORD,WORD,DEFINITION
affection,▪,акт воздействия или действия; состояние воздействия.
affection,Принадлежность:,"атрибут; качество или имущество; состояние; состояние тела; как, фигура, вес и т. д., являются пристрастиями тел."
affection,Привычка,"сознание; ощущение или естественный импульс или естественный импульс, действующий на ум; любая эмоция; как, благожелательные чувства, уважение, благодарность и т. д.; зложелательные чувства, ненависть, зависть и т. д.; склонность; расположение; склонность; склонность."
affection,Определённая,"установленная добрая воля; чувствование доброты; любовь; зависть или склонность к привязанности; — часто в п. Раньше следовало, но теперь более общее, за или к; как, филиальные, социальные или супружеские чувства; иметь любовь к или к детям."
affection,"Неприязнь,",Предупреждение; биас.
affection,"Недостаток,","болезнь; болезненный симптом; болезненный; как, болезнь легких."
affection,Любовное,живое представление любой эмоции.
affection,Недостаток.,Пристрастия.
affection,Страсть.,страсть; насилие эмоций.
affectional,Нежность,"от или относящегося к эмоциям; как, аффективные импульсы; аффективный характер."
affectionate,"Нежность,","имея любовь или теплый взгляд; любить; поклоняться; как, любимый брат."
affectionate,"Нежность,",доброжелательно наклоненный; зелёный.
affectionate,"Нежность,","Проходя из любви; указывая на любовь; склонность; как, любовь к заботе родителей; любовь к контенту, посланию, языку."
affectionate,Сильно,строго наклоненный; — с.
affectionated,симпатичная,расположенный; наклоненный.
affectionately,С,с любовью; любимо; глубоко; скромно; доброжелательно.
affectionateness,Нежность,качество быть любимым; глупость; любовь.
affectioned,Нелюбимый,Предложенный.
affectioned,"Затрагиваемая,",пострадавший; замысел.
affective,Затрагиваемое,склонность влиять; влиять.
affective,Привлекательность,относится к или возбуждает эмоции; эмоциональный; эмоциональный.
affectively,Впечатляющим,Эффективно; впечатляюще; эмоционально.
affectuous,Вся,полный страсти или эмоций; серьезный.
affeer,affeer,для подтверждения; для обеспечения.
affeer,affeer,"оценить или уменьшить, как произвольное наказание или наказание, до определенной и разумной суммы."
affeerer,Affeererer,Alt. of Affeeror
affeeror,Аффеерор,"один, кто афферер."
affeerment,Потрясающе.,акт привязанности.
afferent,afferent,"ношение или ведение внутри к части или органу; — в отличие от эферента; как, аферентные судна; аферентные нервы, которые передают ощущения от внешних органов к мозгу."
affettuoso,Аффеттуозо,с чувством.
affiance,•,заблужденная вера; брачный договор или обещание.
affiance,"Доверие,",доверие; зависимость; вера; доверие.
affianced,Аффиденты,от Affiance
affiancing,Аффиентация,от Affiance
affiance,"Помолвка,","к преданию; к обещанию веры к браку, или к праздновающему обещанию (его или другого) в браке."
affiance,Чтобы,обеспечить обещанием.
affiancer,"Аффиансер,","тот, кто заключает договор о браке между двумя лицами."
affiant,-,кто делает affidavit.
affidavit,Заявление,"заклятое заявление в письменной форме; заявление в письменной форме, подписанное и сделанное на заклятие перед уполномоченным судьей."
affile,для,для польского.
affiliable,способность,"способность быть связанным с или на, или связанным с происхождением."
affiliated,Ассоциированный,от Affiliate
affiliating,родственница,от Affiliate
affiliate,Усыновление/удочерение;,"принять; принимать в семью как сын; следовательно, приносить или принимать в тесные связи; к союзнику."
affiliate,Связи,"для определения отцовства; - сказано о незаконном ребенке; как, для присоединения ребенка к (или на или на) одному человеку, а не к другому."
affiliate,Связи,для подключения в пути спуска; для отслеживания происхождения.
affiliate,Присоединиться,"присоединяться (в) или объединяться (с); принимать в общество в качестве члена, и инициировать в его таинства, планы и т. д.; - следовать за ним или с ним."
affiliate,Ассоциация:,"соединить или ассоциировать себя; - следуя с; как, они ассоциируются с ни одной стороной."
affiliation,::,Усыновление; ассоциация или прием как член семьи или общества.
affiliation,-,"установление или обеспечение родительского отношения; назначение ребенка, как бастада, к отцу; фифилиация."
affiliation,-,соединение в пути спуска.
affinal,affinal,связанный с браком; из одного и того же источника.
affine,affine,для усовершенствования.
affined,Присоединился,присоединился в афинированности или любым связям.
affinitative,Природа,о природе афинитета.
affinitive,аффинитивная,"тесно связанный, как по афинитету."
affinities,Недостатки,афинитета
affinity,Отношения,"отношения по браку (как между супругом и его женой кровяными отношениями, или между женой и ее мужем кровяными отношениями); — в противоречии консервированности, или отношения по крови; — следуя с, к, или между."
affinity,-,"Кенсип в целом; тесное согласие; отношения; соответствие; сходство; связь; как, афинитет звуков, цветов или языков."
affinity,"Родственники,",Партнерство; знакомство.
affinity,"Притягательность,","это притяжение, которое происходит, на нечувствительной расстоянии, между гетерогенными частицами тел, и объединяет их к формированию химических соединений; химизм; химическая или избирательная афинитет или притяжение."
affinity,Соотношение,"отношения между видами или гигги/группами, зависящие от сходства в целом плане структуры, и указывающие сообщество происхождения."
affinity,▪,"Высшая духовная связь или привлекательность, которая иногда должна существовать между лицами, т.е. лицами противоположного пола; также, мужчина или женщина, которые осуществляют такую психическую или духовную привлекательность."
affirmed,подтвержденный,от утверждения
affirming,"Подтверждаю,",от подтверждения
affirm,"Подтверждаем,","утверждать или подтвердить, как решение, указ или распоряжение, вынесенное в апелляционный суд для рассмотрения."
affirm,"Подтверждаем,",утверждать положительно; говорить с уверенностью; утверждать с уверенностью; поддерживать как истинное; - против отрицания.
affirm,"Подтверждаем,","заявлять, как факт, торжественно, под судебным наказанием."
affirm,"Подтверждаем,",заявлять или утверждать положительно.
affirm,"Подтверждаем,","сделать торжественное заявление, перед уполномоченным судом или судом, под санкциями ущерба; свидетельствовать утверждением."
affirmable,Подтверждаемая,"способность быть утвержденным, утвержденным или объявленным; - следовательно; как, утвержденный атрибут каждого справедливого человека."
affirmance,Подтверждающее,подтверждение; ратификация; подтверждение недействительного акта.
affirmance,Подтверждающее,сильное заявление; утверждение.
affirmant,"Тот,","тот, кто утверждает или утверждает."
affirmant,"Тот,","тот, кто утверждает, вместо того, чтобы принимать присягу."
affirmation,-,"подтверждение всего, что установлено; ратификация; как, утверждение закона."
affirmation,-,акт утверждения или утверждения как истинный; утверждение; - против отрицания или отрицания.
affirmation,-,"то, что утверждается; утверждение; положительное заявление; смещение; как, утверждение, продавцом, собственности на продаваемое имущество, или его качества."
affirmation,-,"Праздное заявление, сделанное под санкциями ущерба, лицами, сознательно отказывающимися принимать присягу, заявление которого в законе эквивалентно присяге."
affirmative,Подтверждает;,"подтверждающий; ратифицирующий; как, акт, подтверждающий общее право."
affirmative,-,"это утверждает; утверждает, что факт так; декларирует то, что существует; отвечает «да» на вопрос; - против отрицательного; как, affirmative ответ; affirmative голосование."
affirmative,Положительные;,положительного; догматического.
affirmative,"Да,",выражение согласия двух терминов предложения.
affirmative,Положительный;,"положительный; — термин, применяемый к количествам, которые должны быть добавлены, и противоположно отрицательным, или таким, которые должны быть отклонены."
affirmative,-,"то, что утверждает в противоречии с тем, что отрицает; то, что утверждает в противоречии с тем, что отрицает; то, что утверждает в противоречии с тем, что отрицает; то, что утверждает в противоречии с тем, что отрицает; то, что отрицает; то, что отрицает; то, что отрицает; то, что отрицает; то, что отрицает; то, что"
affirmative,-,"слово или фраза, выражающая утверждение или утверждение; как, да, так и так и т.д."
affirmatively,-,в affirmative; на affirmative стороне вопроса; в affirmative; — в противоположность отрицательному.
affirmatory,Подтверждающий,дайте утверждение; утвердительный; утвердительный.
affirmer,Подтверждаю:,кто утверждает.
affixed,Прикрепляемая,от Affix
affixing,Нанесение,от Affix
affix,Наложить,"подсоединиться, присоединиться или добавить к концу или концу; присоединиться к; присоединиться к любой части; присоединиться к слову; присоединиться к инструменту; присоединиться к письму."
affix,Прикрепить,поправить или покормить любым способом; прикрепить физически.
affix,"Прикрепить,","чтобы присоединиться, объединиться или соединиться с; как, имена, присоединившиеся к идеям, или идеи, присоединившиеся к вещам; чтобы присоединить стигму к человеку; чтобы присоединить смех или вину к любому."
affix,Прикрепить,"чтобы фиксировать или фиксировать фигуративно; - с на или на; как, глаза фиксируются на земле."
affixes,Наклеивает,Affix
affix,Прилагать,"то, что affix; дополнение; esp. один или несколько букв или слайдов добавлены в конце слова; suffix; постфикс."
affixion,Прикрепление,Affixture.
affixture,-,"акт афиксирования, или состояние афиксирования; привязка."
afflation,-,вздутие или дыхание; вдохновение.
afflatus,afflactus,дыхание или взрыв ветра.
afflatus,аффлакт,Божественное распределение знаний; сверхъестественный импульс; вдохновение.
afflicted,Пострадавший,Afflict
afflicting,Затраченное,от Ужасающего
afflict,Ударить,стрелять или бросать; свергнуть.
afflict,"Повреждения,","нанести какие-то серьезные травмы или травмы, вызывая непрерывную боль или психическое беспокойство; тяжело беспокоиться; мучить."
afflict,Повреждения:,сделать низким или скромным.
afflict,Повреждения:,Ужаса.
afflictedness,Пострадавшее,состояние страдания; ужаса.
afflicter,"Пострадавший,",кто ужасает.
afflicting,Затрагиваемая,"грубо болезненное; тревожное; страшное; как, страшное событие. -- Af*flict""ing*ly, adv."
affliction,Несчастье,"причину продолжающейся боли тела или ума, как болезнь, потери и т. д.; случай грубых страданий; боль или печаль."
affliction,"Боль,","состояние страдания; состояние боли, тревоги или страдания."
afflictionless,Безболезненно.,свободный от страданий.
afflictive,Ужасная,давая боль; вызывая непрерывную или повторяющуюся боль или печаль; беспокойство.
afflictively,Отвратительно.,в ужасном виде.
affluence,afolence,потоки в сторону или в сторону; соревнования; приток.
affluence,-,"обильное предложение, как мыслей, слов, чувств и т. д.; пробуждение; также, обильное богатство; богатство."
affluency,аккуратно.,афлуенции.
affluent,"Разбогатевшие,",потока в; потока обильно.
affluent,"Богатый,","обильный; копиальный; полноценный; следовательно, богатый; обильный в товарах или богатстве."
affluent,Богатый,"поток или река, течащий в большую реку или в озеро; поток налогов."
affluently,"Изобилие,",изобильно; копиально.
affluentness,Богатство,Большое количество.
afflux,аффлюкс,"потоки в сторону; то, что течет в сторону; как, приток крови в голову."
affluxion,affluxion,акт потока в сторону; приток.
affodill,Affodill,асфодел.
afforce,для,для укрепления; для укрепления.
afforcement,-,крепость; крепость для обороны.
afforcement,"Усиление,",укрепление; укрепление.
afforciament,afforción,см. Укрепление.
afforded,предоставленные,от Аффорда
affording,Получил,от Аффорда
afford,"Поставляет,","давать; давать, производить или производить в качестве естественного результата, плода или выхода; как, змеи дают вино; маслины дают масло; земля даёт плоды; море даёт обильное питание рыбы."
afford,-,"давать, давать или давать, с удаленным упоминанием о том, что оно является естественным результатом; давать; обладать; как, хорошая жизнь обеспечивает утешение в старости."
afford,-,"предлагать, предоставлять или предлагать, как в продаже, предоставлении, расхождении, с прибылью или без убытков или слишком большим ущербом; как, A предоставляет свои товары дешевле, чем B; человек может предоставлять сумму ежегодно в благотворительности."
afford,-,"вносить, стоять или нести без серьезного ущерба, как акт, который в других обстоятельствах может быть вредоносным; — с вспомогательным, как может, может, может и т. д.; быть способным или достаточно богатым."
affordable,Это,это может быть выгодным.
affordment,-,"все, что дано в качестве помощи; благодать."
afforest,afforest,"превратить в лес; как, превратить в лес тракт страны."
afforestation,-,акт превращения в лес или лес.
afformative,аформативное,Эффикс.
affranchise,аффраншизировать,сделать свободным; отклонить.
affranchisement,Акт,акт освобождения; отклонение.
affrap,аффрап,для удара или удара.
affrayed,Огнестрельное,от Ужасающего
affray,affray,для начала от тишины; для тревоги.
affray,"Аффрэй,",бояться; бояться; бояться.
affray,affray,акт внезапно беспокоить кого-то; нападение или нападение.
affray,"Тревога,",тревога; терроризм; страх.
affray,Неспокойное,опустошительное нападение или столкновение; бриллиант; бриллиант.
affray,affray,"борьба двух или более лиц, в общественном месте, с террором других."
affrayer,Один,один участвует в афрей.
affrayment,Охранник.,«заболевание».
affreight,affravet,"нанимать, как судно, для перевозки груза или груза."
affreighter,аффрайтер,"человек, который арендует или бросает судно для перевозки товаров."
affreightment,afraftment,"акт аренды, или договор использования, судна, или части его, для перевозки груза."
affret,Affret,гневный наступление или атака.
affriction,-,акт ограбления против.
affriended,Мы,сделанные друзья; примиренные.
affrighted,Ужасный,от Affright
affrighting,Ужасный,от Affright
affright,-,впечатлять внезапным страхом; бояться; тревожить.
affright,Я,Affright.
affright,Он,"внезапный и великий страх; ужас. Он выражает сильнее впечатления, чем страх, или угнетение, возможно, меньше, чем ужас."
affright,Аффрайд,"акт страха; также, причину террора; объект страха."
affrightedly,-,с страхом.
affrighten,Напугать,Страх.
affrighter,-,кто боится.
affrightful,Ужасно.,страшный; страшный.
affrightment,-,Страх; состояние страха; внезапный страх или тревога.
affronted,Оскорблённый,от Конфронта
affronting,Противоречие,от Конфронтации
affront,Оскорбление:,на фронт; на лице в позиции; на встречу или на встречу лице в лице.
affront,"Противоречие,","столкнуться с враждебностью; столкнуться; как, столкнуться с смертью; следовательно, столкнуться в враждебной встрече."
affront,Оскорбить,оскорблять каким-то проявлением недоверия; оскорблять лицо деменцией или языком; обращаться с выраженной неграмотностью.
affront,Оскорбление:,"встреча либо дружественная, либо враждебная."
affront,Оскорбительное,"безнадежное или грубое обращение, которое возбуждает или оправдывает возмущение; отмеченное недоверие; целенаправленное ненависть; оскорбление."
affront,-,Нарушение самооценки; стыд.
affronte,Посягать,"лицем в лице, или лицем в лице; лицем в лице."
affrontedly,Безжалостно.,безжалостно.
affrontee,"Оскорбитель,",кто получает афронт.
